{"files":[{"byte_length":"32416","content":"{\n  \"analysis_result_fields\": [\n    {\n      \"wire\": \"canonical-analysis-ir\",\n      \"requirements\": [\n        \"GNT-12.9\"\n      ]\n    },\n    {\n      \"wire\": \"closed-executable-projection\",\n      \"requirements\": [\n        \"GNT-12.9\"\n      ]\n    },\n    {\n      \"wire\": \"concrete-effects\",\n      \"requirements\": [\n        \"GNT-12.9\"\n      ]\n    },\n    {\n      \"wire\": \"concrete-schemas\",\n      \"requirements\": [\n        \"GNT-12.9\",\n        \"GNT-8.13-concrete-generic-schemas\"\n      ]\n    },\n    {\n      \"wire\": \"generic-binders\",\n      \"requirements\": [\n        \"GNT-12.9\"\n      ]\n    },\n    {\n      \"wire\": \"inferred-substitutions\",\n      \"requirements\": [\n        \"GNT-12.9\"\n      ]\n    },\n    {\n      \"wire\": \"package-source-manifest\",\n      \"requirements\": [\n        \"GNT-11.6-package-source-manifest\"\n      ]\n    },\n    {\n      \"wire\": \"retained-instantiations\",\n      \"requirements\": [\n        \"GNT-12.9\"\n      ]\n    },\n    {\n      \"wire\": \"selected-implementations\",\n      \"requirements\": [\n        \"GNT-12.9\"\n      ]\n    },\n    {\n      \"wire\": \"source-map\",\n      \"requirements\": [\n        \"GNT-11.6\",\n        \"GNT-12.9\"\n      ]\n    },\n    {\n      \"wire\": \"template-effects\",\n      \"requirements\": [\n        \"GNT-12.9\"\n      ]\n    }\n  ],\n  \"catalog\": \"gantry.embedding-contracts\",\n  \"major\": 1,\n  \"minor\": 0,\n  \"specification_revision\": \"49c3fe100b4109ba227f9d48cd083a6f32753d7ae881afbbb67b3c40273b0cbf\",\n  \"operations\": [\n    {\n      \"wire\": \"abort-task\",\n      \"rust\": \"AbortTask\",\n      \"service\": \"executor\",\n      \"role\": \"executor-adapter\",\n      \"applicable_profiles\": [\n        \"embedding\",\n        \"evaluator\"\n      ],\n      \"request_fields\": [\n        \"task_handle\"\n      ],\n      \"optional_request_fields\": [],\n      \"result_variants\": [\n        \"already-settled\",\n        \"failed\",\n        \"stopped\"\n      ],\n      \"error_categories\": [\n        \"executor-failure\"\n      ],\n      \"acceptance\": \"adapter-call\",\n      \"idempotency\": \"idempotent\",\n      \"cancellation\": \"must-settle\",\n      \"async_kind\": \"borrowed-future\",\n      \"requirements\": [\n        \"GNT-15.4\",\n        \"GNT-15.4-owned-work\",\n        \"GNT-15.9-boundary-failure-containment\"\n      ]\n    },\n    {\n      \"wire\": \"acquire-journal-owner\",\n      \"rust\": \"AcquireJournalOwner\",\n      \"service\": \"journal\",\n      \"role\": \"journal-storage\",\n      \"applicable_profiles\": [\n        \"durable-runtime\",\n        \"embedding\"\n      ],\n      \"request_fields\": [\n        \"journal_id\",\n        \"operation_kind\"\n      ],\n      \"optional_request_fields\": [],\n      \"result_variants\": [\n        \"acquired\",\n        \"failed\"\n      ],\n      \"error_categories\": [\n        \"journal-failure\",\n        \"ownership-acquisition\"\n      ],\n      \"acceptance\": \"fenced-owner-acquisition\",\n      \"idempotency\": \"linearizable-race\",\n      \"cancellation\": \"must-settle\",\n      \"async_kind\": \"borrowed-future\",\n      \"requirements\": [\n        \"GNT-11.2\",\n        \"GNT-15.5\",\n        \"GNT-15.9-boundary-failure-containment\"\n      ]\n    },\n    {\n      \"wire\": \"analyze-package\",\n      \"rust\": \"AnalyzePackage\",\n      \"service\": \"lifecycle\",\n      \"role\": \"interpreter\",\n      \"applicable_profiles\": [\n        \"analyzer\",\n        \"embedding\"\n      ],\n      \"request_fields\": [\n        \"frontend_limits\",\n        \"package_root\",\n        \"protocol_selection\"\n      ],\n      \"optional_request_fields\": [\n        \"event_delivery\"\n      ],\n      \"result_variants\": [\n        \"operational-failure\",\n        \"source-invalid\",\n        \"source-valid\"\n      ],\n      \"error_categories\": [\n        \"frontend-resource-limit\",\n        \"implementation-resource-exhaustion\",\n        \"internal\",\n        \"lifecycle\",\n        \"required-event-delivery\"\n      ],\n      \"acceptance\": \"public-operation-admission\",\n      \"idempotency\": \"semantically-repeatable\",\n      \"cancellation\": \"caller-stops-waiting\",\n      \"async_kind\": \"borrowed-future\",\n      \"requirements\": [\n        \"GNT-12.10\",\n        \"GNT-12.11-generic-diagnostics\",\n        \"GNT-15.1\",\n        \"GNT-15.1-automatic-execution\",\n        \"GNT-15.1-concurrency-and-reentrancy\",\n        \"GNT-3.15-generic-profiles\",\n        \"GNT-4.17-frontend-resource-limits\",\n        \"GNT-4.17-generic-analysis-limits\"\n      ]\n    },\n    {\n      \"wire\": \"await-foreground\",\n      \"rust\": \"AwaitForeground\",\n      \"service\": \"lifecycle\",\n      \"role\": \"interpreter\",\n      \"applicable_profiles\": [\n        \"embedding\",\n        \"evaluator\"\n      ],\n      \"request_fields\": [\n        \"execution_handle\"\n      ],\n      \"optional_request_fields\": [],\n      \"result_variants\": [\n        \"run-failed-nondurably\",\n        \"terminal\"\n      ],\n      \"error_categories\": [\n        \"internal-invariant-failure\",\n        \"journal-failure\",\n        \"lifecycle\"\n      ],\n      \"acceptance\": \"waiter-registration\",\n      \"idempotency\": \"read-only\",\n      \"cancellation\": \"waiter-only\",\n      \"async_kind\": \"borrowed-future\",\n      \"requirements\": [\n        \"GNT-15.1\",\n        \"GNT-15.1-automatic-execution\",\n        \"GNT-15.1-concurrency-and-reentrancy\"\n      ]\n    },\n    {\n      \"wire\": \"await-terminal\",\n      \"rust\": \"AwaitTerminal\",\n      \"service\": \"lifecycle\",\n      \"role\": \"interpreter\",\n      \"applicable_profiles\": [\n        \"embedding\",\n        \"evaluator\"\n      ],\n      \"request_fields\": [\n        \"execution_handle\"\n      ],\n      \"optional_request_fields\": [],\n      \"result_variants\": [\n        \"run-failed-nondurably\",\n        \"terminal\"\n      ],\n      \"error_categories\": [\n        \"internal-invariant-failure\",\n        \"journal-failure\",\n        \"lifecycle\"\n      ],\n      \"acceptance\": \"waiter-registration\",\n      \"idempotency\": \"read-only\",\n      \"cancellation\": \"waiter-only\",\n      \"async_kind\": \"borrowed-future\",\n      \"requirements\": [\n        \"GNT-15.1\",\n        \"GNT-15.1-automatic-execution\",\n        \"GNT-15.1-concurrency-and-reentrancy\"\n      ]\n    },\n    {\n      \"wire\": \"cancel-execution\",\n      \"rust\": \"CancelExecution\",\n      \"service\": \"lifecycle\",\n      \"role\": \"interpreter\",\n      \"applicable_profiles\": [\n        \"embedding\",\n        \"evaluator\"\n      ],\n      \"request_fields\": [\n        \"cancellation_reason\",\n        \"execution_id\"\n      ],\n      \"optional_request_fields\": [],\n      \"result_variants\": [\n        \"accepted\",\n        \"already-terminal\",\n        \"failed\",\n        \"not-found\"\n      ],\n      \"error_categories\": [\n        \"internal-invariant-failure\",\n        \"journal-failure\",\n        \"lifecycle\"\n      ],\n      \"acceptance\": \"cancellation-record\",\n      \"idempotency\": \"first-effective-reason\",\n      \"cancellation\": \"monotonic\",\n      \"async_kind\": \"borrowed-future\",\n      \"requirements\": [\n        \"GNT-10.10\",\n        \"GNT-15.1\",\n        \"GNT-15.1-automatic-execution\",\n        \"GNT-15.3\"\n      ]\n    },\n    {\n      \"wire\": \"commit-journal-batch\",\n      \"rust\": \"CommitJournalBatch\",\n      \"service\": \"journal\",\n      \"role\": \"journal-storage\",\n      \"applicable_profiles\": [\n        \"durable-runtime\",\n        \"embedding\"\n      ],\n      \"request_fields\": [\n        \"batch\",\n        \"journal_id\",\n        \"ownership_token\"\n      ],\n      \"optional_request_fields\": [],\n      \"result_variants\": [\n        \"committed\",\n        \"failed\"\n      ],\n      \"error_categories\": [\n        \"journal-failure\"\n      ],\n      \"acceptance\": \"durable-atomic-commit\",\n      \"idempotency\": \"batch-contract\",\n      \"cancellation\": \"must-settle\",\n      \"async_kind\": \"borrowed-future\",\n      \"requirements\": [\n        \"GNT-11.2\",\n        \"GNT-15.5\",\n        \"GNT-15.9-boundary-failure-containment\"\n      ]\n    },\n    {\n      \"wire\": \"create-hook\",\n      \"rust\": \"CreateHook\",\n      \"service\": \"hook\",\n      \"role\": \"hook-factory\",\n      \"applicable_profiles\": [\n        \"embedding\",\n        \"evaluator\"\n      ],\n      \"request_fields\": [\n        \"task_context\"\n      ],\n      \"optional_request_fields\": [],\n      \"result_variants\": [\n        \"created\",\n        \"failed\"\n      ],\n      \"error_categories\": [\n        \"hook-creation\"\n      ],\n      \"acceptance\": \"hook-instance-created\",\n      \"idempotency\": \"at-most-once-per-task-run\",\n      \"cancellation\": \"gantry-token\",\n      \"async_kind\": \"borrowed-future\",\n      \"requirements\": [\n        \"GNT-15.10-protected-values\",\n        \"GNT-15.2\",\n        \"GNT-15.9-boundary-failure-containment\"\n      ]\n    },\n    {\n      \"wire\": \"deadline-race\",\n      \"rust\": \"DeadlineRace\",\n      \"service\": \"executor\",\n      \"role\": \"executor-adapter\",\n      \"applicable_profiles\": [\n        \"embedding\",\n        \"evaluator\"\n      ],\n      \"request_fields\": [\n        \"deadline\",\n        \"future\"\n      ],\n      \"optional_request_fields\": [\n        \"cancellation\"\n      ],\n      \"result_variants\": [\n        \"completed\",\n        \"failed\",\n        \"timed-out\"\n      ],\n      \"error_categories\": [\n        \"executor-failure\"\n      ],\n      \"acceptance\": \"completion-or-deadline\",\n      \"idempotency\": \"single-race\",\n      \"cancellation\":